Title,Reviews,Sold,Original Price,Store Name,Store City,Description,Order Processing,Positive Feedback,Total Feedback,Product URL
Keyboard Gaming CORSAIR K70 RGB PRO with PBT DOUBLE SHOT PRO Keycaps ,,,Rp2.799.000,Asiatech Dusit,Jakarta Pusat,"Keyboard Gaming CORSAIR K70 RGB PRO with PBT DOUBLE SHOT PRO Keycaps*Konfirmasi stok sebelum pemesananSWITCH:CHERRYMX BROWN CH-9109412-NACHERRYMX RED CH-9109410-NAKeyboard Warranty 2 YearWeight 1.15kgLighting RGBKeyboard Layout NAUSB Polling Rate Up to 8,000Hz with AXONMatrix 104 KeysConnectivity WiredAdjustable Height YesMedia Controls YN YesKeyboard Type Size K70Keyboard Product Family K70Keyboard Rollover Full Key (NKRO) with 100% Anti-GhostingForm Factor Full SizeWired Connectivity USB 3.0 or 3.1 Type-AOn-Board Memory 8MBNumber Onboard profiles Up to 50WIN Lock Dedicated HotkeyMedia Control Dedicated Hotkeys, Volume RollerPalm Rest Magnetic detachable, soft touchKeyboard CUE Software Supported in iCUECable Type BraidedIntergated Touchpad 444mm x 166mm x 40mmGARANSI DTG INDONESIA",± 13 jam,927 Feedback Positif,dari 965 feedback,https://www.bukalapak.com/p/komputer/aksesoris-226/keyboard/4h4blwp-jual-keyboard-gaming-corsair-k70-rgb-pro-with-pbt-double-shot-pro-keycaps
Robot Workmate II Keyboard Mechanical Gaming Wired Kabel 94 Keys PBT Keycaps Workmatte ,,,Rp319.900,Alex Store,Denpasar,"Alex Store Accessories Phone Gadget PC always OriginalAll Premium Device Wearable for youKeunggulan:1. 94 Compact Layout2. Port USB-C dan Outemu yang dapat dilepas3. Kualitas Switch A+4. Colorful backlight effect, ubah dan sesuaikan efek lampu kapan saja5. 60% tata letak yang rapat, kecil, hemat ruang dan tidak memakan ruang desktop, mudah dibawa6. Kabel dan tombol terpisah7. Poros mekanis yang dapat dicolokkan dan disesuaikan dengan kenyamanan anda7. Ergonomic design sehingga mengetik lebih nyaman8. Menggunakan bahan yang kuat, tahan korosi, bertekstur halus dan tidak memudarSpesifikasi:*Model : WORKMATE II*Size : 29*10*3cm*Number of keys : 94*Switch : Blue*Input : 5V 180ma*Wired Interface : USB*Length of the wire : 1.5m*Weight : 3.75KG*System supports : Windows, MAC, OS, ChromeKelengkapan:1x Keyboard WORKMATE II",± 5 jam,3.437 Feedback Positif,dari 3.441 feedback,https://www.bukalapak.com/p/komputer/gaming/mouse-keyboard-gaming/4hn5qx7-jual-robot-workmate-ii-keyboard-mechanical-gaming-wired-kabel-94-keys-pbt-keycaps-workmatte
Gamen GMK01 Keycaps Keyboard Mekanik MX Double Shot PBT Mechanical ,,1 Terjual,Rp79.000,mmcroxy,Jakarta Pusat,"Keunggulan:Warna lucu desain manis senada dengan warna merah bunga sakuraBahan PBT dengam injeksi 2 warna, lebih kuat dan tidak berminyakKompatibel dengan keyboard mekanik MXKompatibel untuk umum tombol pendek maupun stabilizer satellite pada tombol panjangSpesifikasi:Model : GMK01Keys : 104 ( termasuk key puller)NOTE : Tidak menerima komplain produk cacat fisik/tidak lengkap apabila produk tsb sudah dikeluarkan dari kemasan (kecuali ada video unboxing dan akan kami bantu komplain ke pihak ekspedisi).",± 22 jam,19.559 Feedback Positif,dari 19.732 feedback,https://www.bukalapak.com/p/komputer/aksesoris-226/aksesoris-lainnya-241/4hii934-jual-gamen-gmk01-keycaps-keyboard-mekanik-mx-double-shot-pbt-mechanical
Robot Workmate II Mechanical keyboard Gaming 94keys PBT Keycaps ,,,Rp314.000,Thewisest OkeSop,Denpasar,"Robot Workmate II Mechanical keyboard Gaming 94keys PBT KeycapsOriginal 100 %Garansi Resmi BNIB SEGEL Thewisest Okesop Keunggulan:1. 94 Compact Layout2. Port USB-C dan Outemu yang dapat dilepas3. Kualitas Switch A+4. Colorful backlight effect, ubah dan sesuaikan efek lampu kapan saja5. 60% tata letak yang rapat, kecil, hemat ruang dan tidak memakan ruang desktop, mudah dibawa6. Kabel dan tombol terpisah7. Poros mekanis yang dapat dicolokkan dan disesuaikan dengan kenyamanan anda7. Ergonomic design sehingga mengetik lebih nyaman8. Menggunakan bahan yang kuat, tahan korosi, bertekstur halus dan tidak memudarSpesifikasi:*Model : WORKMATE II*Size : 29*10*3cm*Number of keys : 94*Switch : Blue*Input : 5V 180ma*Wired Interface : USB*Length of the wire : 1.5m*Weight : 3.75KG*System supports : Windows, MAC, OS, ChromeKelengkapan1x Keyboard WORKMATE II",± 8 jam,1.237 Feedback Positif,dari 1.258 feedback,https://www.bukalapak.com/p/komputer/aksesoris-226/keyboard/4hnnfgp-jual-robot-workmate-ii-mechanical-keyboard-gaming-94keys-pbt-keycaps
Redragon PBT Double Shot 150 Keycaps For All Mechanical Keyboard- A132 ,,,Rp380.000,Redragon Indonesia,Jakarta Utara,"FEATURESRedragon full-size CSA profile PBT keycap set,150 PCS for full compatibility.1. Compatible with all Redragon mechanical keyboards2. High-grade doubleshot PBT material with a sturdy, textured finish3. Extra-thick key walls provides maximum durability and solid key presses4. Enhanced the arc and keycap-finger contact area to bring more comfortable typing5. Consisting 150 keycaps fits with customized mechanical keyboard in 108/104/96/84/78/68/61 layoutTECH SPECSStandard Keycap Dimensions:18.5 x 18.5mm (bottom)Material:PBTStyle:Double shotLayout:US [ANSI]Profile:CSAKeys:150Color:Black/WhiteFont:Non-translucent",± 1-2 hari,23 Feedback Positif,dari 29 feedback,https://www.bukalapak.com/p/g-komputer/g-gaming/g-mouse-keyboard-gaming/4hmmc24-jual-redragon-pbt-double-shot-150-keycaps-for-all-mechanical-keyboard-a132
Keyboard Mechanical Gaming ROBOT WORKMATE II 94 Keys PBT Keycaps TypeC ,,,Rp310.000,lisensiantivirus,Bandar Lampung,"Keyboard Gaming Mechanical Robot seri terbaru ya ini Sahabat LisensiantivirusAda Numpadnya, jadi mendukung banget multifungsinyadan keycapbsnya sudah pbt dapat dicopot dan diganti sesuai kebutuhanKeunggulan:94 Compact LayoutPort USB-C dan Outemu yang dapat dilepasKualitas Switch A+Colorful backlight effect, ubah dan sesuaikan efek lampu kapan saja60% tata letak yang rapat, kecil, hemat ruang dan tidak memakan ruang desktop, mudah dibawaKabel dan tombol terpisahPoros mekanis yang dapat dicolokkan dan disesuaikan dengan kenyamanan andaErgonomic design sehingga mengetik lebih nyamanMenggunakan bahan yang kuat, tahan korosi, bertekstur halus dan tidak memudarSpesifikasi:Model : WORKMATE II*Size : 2910*3cm*Number of keys : 94*Switch : Blue*Input : 5V 180ma*Wired Interface : USB*Length of the wire : 1.5m*Weight : 3.75KG*System supports : Windows, MAC, OS, ChromeKelengkapan1x Keyboard WORKMATE IIGaransi Robot 1 Tahun",± 14 jam,378 Feedback Positif,dari 385 feedback,https://www.bukalapak.com/p/komputer/aksesoris-226/keyboard/4hp0tna-jual-keyboard-mechanical-gaming-robot-workmate-ii-94-keys-pbt-keycaps-typec
,,,,,,,,,,https://www.bukalapak.com/u/alexstore8
,,,,,,,,,,https://www.bukalapak.com/u/redragonindonesia
,,,,,,,,,,https://www.bukalapak.com/u/mmcroxy
,,,,,,,,,,https://www.bukalapak.com/u/arif_dwi_septian84
Keycaps Puller for PC Cherry MX Mechanical Keyboard ,,,Rp49.000,Arlisoon Shop,Jakarta Barat,"Mengganti tombol keyboard untuk para gamer merupakan hal yang cukup penting mengingat APM (Action Per Minute) pada tombol keyboard cukup signifikan. Dengan ini, mengganti tombol keyboard yang rusak akan menjadi lebih praktis dan gampang.High Quality MaterialKeycaps Puller / Alat pencabut tombol keyboard ini terbuat dari bahan material plastik berkualitas yang kokoh dan tidak mudah patah ketika digunakan untuk mencabut tombol keyboard.Great for FPS GamerMengganti tombol keyboard untuk para gamer FPS merupakan hal yang cukup penting mengingat APM (Action Per Minute) pada tombol keyboard cukup signifikan. Anda dapat mengganti tombol yang rusak ataupun dengan tombol keyboard custom.Puller for PC Keyboard and MX Switch KeycapsDengan alat ini, mengganti tombol keyboard akan menjadi lebih praktis dan tidak memakan banyak waktu.",± 1-2 hari,15.714 Feedback Positif,dari 15.714 feedback,https://www.bukalapak.com/p/komputer/aksesoris-226/aksesoris-lainnya-241/3lctw3-jual-keycaps-puller-for-pc-cherry-mx-mechanical-keyboard
Tuts Keyboard Tombol Keycaps Microsoft Surface Pro 1/2/3/4/5 ,,,Rp20.000,hendra benny prasetyo,Buleleng,"Tuts Keyboard Tombol Keycaps Microsoft Surface Pro 1/2/3/4/5Harga untuk 1pcs tuts ( termasuk clip )2ND bongkaran Original 100% testedcantumkan di note, kalau tidak dikirimkan random",± 1-2 hari,37 Feedback Positif,dari 38 feedback,https://www.bukalapak.com/p/komputer/aksesoris-226/keyboard/4hq38e7-jual-tuts-keyboard-tombol-keycaps-microsoft-surface-pro-1-2-3-4-5
Redragon SCARAB A130 PBT Pudding Keycaps for Mechanical Gaming Keyboard ,1 Ulasan,1 Terjual,Rp139.000,Clover Gaming Indonesia,Bandung,"Clover Gaming IndonesiaMOHON MESSAGE KAMI UNTUK CEK STOK LEBIH DULU :)Untuk mempermudah agan2 semua, silakan langsung message kami jika ada yang ingin ditanyakan :DSeluruh produk yang kami jual merupakan :100% Original100% BNIB100% Garansi ResmiWhat you see is what you getKepuasan agan adalah prioritas utama kami :)============================================REDRAGON SCARAB A130 FOR MECHANICAL GAMING KEYBOARDFor 104 Key mechanical keyboardsDouble shot PBT Pudding keycapsInclude key-puller",± 1-2 hari,3.247 Feedback Positif,dari 3.590 feedback,https://www.bukalapak.com/p/komputer/aksesoris-226/keyboard/4gdpse1-jual-redragon-scarab-a130-pbt-pudding-keycaps-for-mechanical-gaming-keyboard
KEYCAP PULLER - MECHANICAL KEYBOARD - METAL KEYCAPS PULLER ,,,Rp45.000,Rumah Keyboard,Jakarta Barat,KEYCAP PULLER - MECHANICAL KEYBOARD - METAL KEYCAPS PULLERBrand : AXE | MECHANICALSModel   : Keycap Puller for Mechanical KeyboardColor     : Blue / Purple / Gold / RedSuit For : Every Keycap,± 21 jam,6 Feedback Positif,dari 7 feedback,https://www.bukalapak.com/p/komputer/gaming/mouse-keyboard-gaming/4hhjzw1-jual-keycap-puller-mechanical-keyboard-metal-keycaps-puller
,,,,,,,,,,https://www.bukalapak.com/u/lisensiantivirus
,,,,,,,,,,https://www.bukalapak.com/u/clovergaming
Rexus Keyboard M64 Classic DAXA Keycaps Gaming Ultimate M64 RGB LED ,,,Rp1.000.000,Kedaitronik,Surabaya,"Terbaru dari lini Daxa, hadir dengan tampilan yang compact, modern, dan elegan, Keyboard Gaming Mekanikal DAXA M64 Classic menjadi pilihan terbaik untuk Anda yang membutuhkan keyboard ideal dengan banyak fungsi.Keyboard Gaming Mekanikal DAXA M64 Classic dilengkapi dengan 64 tombol anti-ghosting yang menggunakan profil XDA PBT dye-sub dan juga menjadi keyboard pertama Rexus yang memiliki south-facing switch yang dipersenjatai dengan Gateron KS-9 serta didukung teknologi Hotswappable yang tentunya memudahkan Anda yang gemar modifikasi keyboard.Keyboard Gaming Mekanikal DAXA M64 Classic sudah termasuk EVA foam pada case dan plate-nya, dan menggunakan stabilizer yang sudah pre-lubed sehingga suara yang dihasilkan saat melakukan pengetikan terdengar lebih lembut dan terasa lebih nyaman digunakan.Fitur Unggulan:Stylish Design in Two ColorsMusic Synchronize Through LED with Software50M Lifespan Gateron SwitchSouth-Facing Switches BetterHot-swappable SwitchDimensi dan desain yang simpel dan penuh gayaDua varian warna: Black dan WhiteTeknologi Hot-swappable switchSouth-Facing Switch untuk penggunaan segala jenis keycapDilengkapi dengan fungsi Macro untuk mendukung permainan dan aktivitas mengetik yang lebih mudah dan lengkapTeknologi music synchronize pada pengaturan LED yang dapat diatur dengan softwareKompatibel dengan semua platform sistem operasionalSpesifikasi TeknisLayout : 64 TombolLampu Latar : South-Facing RGB LEDMaterial Case : ABSKeycaps : 2-tone PBT Dye-SubDukungan Switch : Hotswap (3 & 5 Pin)Switch : Gateron KS-9Stabilizer : Pre-lubedKoneksi : KabelKabel : 1.8m Golded Braided Type-CDaya : 3.7V-5V / 300MaDukungan Sistem : Windows 98, 2000, XP, ME, Vista, Win7, Win8, Win10, Win11, dan Mac OSUkuran : 29011038mmIsi paket Daxa M64 Classic:1x Keyboard Daxa M64 Classic1x Kabel USB Type-C 1.8m1x Penarik Switch + Keycaps4pcs Switch Tambahan7pcs Keycaps Tambahan1x Panduan Pengguna1x Kartu Garansi",± 15 jam,8.634 Feedback Positif,dari 8.666 feedback,https://www.bukalapak.com/p/komputer/aksesoris-226/keyboard/4h36oi7-jual-rexus-keyboard-m64-classic-daxa-keycaps-gaming-ultimate-m64-rgb-led
Keycaps Mechanical Keyboard GUILTY CROWN INORI 136 Keys PBT Cherry Profile ,,,Rp469.000,Gaming Distro,Jakarta Pusat,"Hi, Welcome to GAMING DISTRO - Authorized Gaming StoreProduk ini 100% NEWHarap untuk menanyakan stok sebelum orderPengiriman via Ojek-Online harap konfirmasi ke kita dulu sebelum checkoutHarap Lakukan video unboxing (tanpa cut/edit) dari ketika paket diterima guna memudahkan & memberikan info valid saat pelaporan barang jika terdapat kendalaProfil CherryBahan dari PBT (Polybutylene Terephthalate) Dyesub136 keysetTidak tembus lampu LEDCocok untuk mechanical keyboard dengan switch : Cherry MX, Outemu, GateronKeycaps 100% NEWCocok untuk ukuran Full size, TKL, dan 60%",± 1-2 hari,1.216 Feedback Positif,dari 1.275 feedback,https://www.bukalapak.com/p/komputer/aksesoris-226/keyboard/4hhlck4-jual-keycaps-mechanical-keyboard-guilty-crown-inori-136-keys-pbt-cherry-profile
,,,,,,,,,,https://www.bukalapak.com/u/ijall99
Keycaps Mechanical Keyboard WEATHER HIRAGANA 132 Keys PBT XDA Profile ,,,Rp469.000,Gaming Distro,Jakarta Pusat,"Hi, Welcome to GAMING DISTRO - Authorized Gaming StoreProduk ini 100% NEWHarap untuk menanyakan stok sebelum orderPengiriman via Ojek-Online harap konfirmasi ke kita dulu sebelum checkoutHarap Lakukan video unboxing (tanpa cut/edit) dari ketika paket diterima guna memudahkan & memberikan info valid saat pelaporan barang jika terdapat kendalaBahan : PBTProfile : XDAWarna : Dye-SubJumlah : 132 KeysFont : EN/HiraganaKompatible : 61/64/68/78/84/87/96/98/104/108 tombol keyboard mekanik(Anda dapat berkonsultasi dengan chat untuk kompatibilitas saat membeli)Cocok untuk mechanical keyboard dengan switch : Cherry MX, Outemu, Gateron, Etc",± 1-2 hari,1.216 Feedback Positif,dari 1.275 feedback,https://www.bukalapak.com/p/komputer/aksesoris-226/keyboard/4hhlcld-jual-keycaps-mechanical-keyboard-weather-hiragana-132-keys-pbt-xda-profile
,,,,,,,,,,https://www.bukalapak.com/u/rumah_keyboard_990137
,,,,,,,,,,https://www.bukalapak.com/u/syasha_861626
Mechanical Keyboard Keycaps Gaming Imperion Rainbow ,,,Rp113.000,syasha,Jakarta Selatan,465492915Specification :* Tombol : 37 Tombol* Material : ABS* Compatible : Semua keyboard MechanicalModel : AJAZZ AK33 RGBKey Number :82 KeysAntighost Keys :Full Antighost keysKey Pressure :60+/-20gfKey Life :More than 50 million timesProduct Weight :60+/-20gSize :310.5 x 120 x 36.8 +/-0.5mmCable Length :1.6mSKU : 3131/1056415779167846400/55,± 2-3 hari,1 Feedback Positif,dari 10 feedback,https://www.bukalapak.com/p/komputer/aksesoris-226/keyboard/4fk34ws-jual-mechanical-keyboard-keycaps-gaming-imperion-rainbow
Keycaps Mechanical Keyboard GENSHIN IMPACT KEQING 146 Keys PBT Cherry Profile ,,,Rp649.000,Gaming Distro,Jakarta Pusat,"Hi, Welcome to GAMING DISTRO - Authorized Gaming StoreProduk ini 100% NEWHarap untuk menanyakan stok sebelum orderPengiriman via Ojek-Online harap konfirmasi ke kita dulu sebelum checkoutHarap Lakukan video unboxing (tanpa cut/edit) dari ketika paket diterima guna memudahkan & memberikan info valid saat pelaporan barang jika terdapat kendalaProfil Cherry.Bahan dari PBT (Polybutylene Terephthalate) Dyesub146 keysetTidak tembus lampu LEDCocok untuk mechanical keyboard dengan switch : Cherry MX, Outemu, GateronKeycaps 100% NEWCocok untuk ukuran Full size, TKL, dan 60%",± 1-2 hari,1.216 Feedback Positif,dari 1.275 feedback,https://www.bukalapak.com/p/komputer/aksesoris-226/keyboard/4hhlcg4-jual-keycaps-mechanical-keyboard-genshin-impact-keqing-146-keys-pbt-cherry-profile
Keycaps Mechanical Keyboard Akko Olivia | MDA Profile 158 Keycaps Set PBT Double Shot ,,,Rp389.000,Gaming Distro,Jakarta Pusat,"Hi, Welcome to GAMING DISTRO - Authorized Dealer AkkoProduk ini 100% Original by AkkoHarap untuk menanyakan stok sebelum orderPengiriman via Ojek-Online harap konfirmasi ke kita dulu sebelum checkoutHarap Lakukan video unboxing (tanpa cut/edit) dari ketika paket diterima guna memudahkan & memberikan info valid saat pelaporan barang jika terdapat kendalaTech specs:158 Keys TotalPBT Double ShotMDA ProfileSuitable For Any Layout",± 1-2 hari,1.216 Feedback Positif,dari 1.275 feedback,https://www.bukalapak.com/p/komputer/gaming/mouse-keyboard-gaming/4hh02q7-jual-keycaps-mechanical-keyboard-akko-olivia-mda-profile-158-keycaps-set-pbt-double-shot
Keycaps Pudding HyperX PBT Material for Mechanical Keyboard ,,,Rp471.000,Gaming Distro,Jakarta Pusat,"Hi, Welcome to GAMING DISTRO - Authorized Dealer HYPERXProduk ini 100% Original by HYPERXHarap untuk menanyakan stok sebelum orderPengiriman via Ojek-Online harap konfirmasi ke kita dulu sebelum checkoutHarap Lakukan video unboxing (tanpa cut/edit) dari ketika paket diterima guna memudahkan & memberikan info valid saat pelaporan barang jika terdapat kendalaVarian Warna: Black / White / PinkTidak mencantumkan warna di catatan maka akan dikirim random.Jika sudah mencantumkan warna tetapi barang tidak ready karena sebelumnya tidak tanya stok, kami akan konfirmasi ulang sebelum dikirim :)ORDER = Dianggap Sudah Membaca Ketentuan Yang Berlaku ^^Features:Durable Double shot PBT Material: HyperX PBT keycaps are made with thick walls and are resistant to wear, friction, and solvents. Theyre available in different color options to mix and match with various keyboard styles.Signature HyperX shine-through font: These PBT keycaps are made with thick walls and are resistant to wear, friction, and solvents.Stylish keycap removal tool included: Our keycap removal tool is specially-designed to precisely fit HyperX keycaps.Compatible with most HyperX mechanical gaming keyboards: The full key set is compatible with most HyperX mechanical keyboards and mechanical gaming keyboards with a standard bottom row. They complement the exposed LED design of HyperX mechanical key switches.Designed to enhance RGB lighting: HyperX PBT Keycaps are durable and feature our signature HyperX font, which is designed to let keyboard lighting shine brilliantly.Technical Specs:Material: PBTCompatibility: Compatible with most HyperX mechanical gaming keyboards and most mechanical keyboards with a standard bottom row.",± 1-2 hari,1.216 Feedback Positif,dari 1.275 feedback,https://www.bukalapak.com/p/komputer/aksesoris-226/keyboard/4hcafc4-jual-keycaps-pudding-hyperx-pbt-material-for-mechanical-keyboard
Keycaps Mechanical Keyboard Akko Starry Night | OSA Profile 185 Keycaps Set PBT Double Shot ,,,Rp799.000,Gaming Distro,Jakarta Pusat,"Hi, Welcome to GAMING DISTRO - Authorized Dealer AkkoProduk ini 100% Original by AkkoHarap untuk menanyakan stok sebelum orderPengiriman via Ojek-Online harap konfirmasi ke kita dulu sebelum checkoutHarap Lakukan video unboxing (tanpa cut/edit) dari ketika paket diterima guna memudahkan & memberikan info valid saat pelaporan barang jika terdapat kendalaTech Specs:185 Keys OSA Profile PBT Keycaps SetPBT Double Shot keycaps185 keys with Large FontsSuitable for ANSI & ISO LayoutCompatible with 60%/65%/75%/TKL compact or full size keyboards",± 1-2 hari,1.216 Feedback Positif,dari 1.275 feedback,https://www.bukalapak.com/p/komputer/gaming/mouse-keyboard-gaming/4hh02vg-jual-keycaps-mechanical-keyboard-akko-starry-night-osa-profile-185-keycaps-set-pbt-double-shot
Mechanical Keyboard PBT Pudding Keycaps Redragon SCARAB A130 Keycaps ,,,Rp108.000,Citra Komputer,Jakarta Barat,SETIAP PEMBELIAN REDRAGON SCARAB A130 FREE LOGAM MULIA 24 KARATSELAMA PERSEDIAAN MASIH ADABURUAN CEKOUT !!!!REDRAGON SCARAB A130 FOR KEYBOARDFor 104 Key mechanical keyboardsDouble shot PBT Pudding keycapsInclude key-puller,± 15 jam,11.197 Feedback Positif,dari 11.794 feedback,https://www.bukalapak.com/p/komputer/aksesoris-226/aksesoris-lainnya-241/4hg2qod-jual-mechanical-keyboard-pbt-pudding-keycaps-redragon-scarab-a130-keycaps
Keycaps Pudding HyperX 104 Keys for Mechanical Keyboard ,,,Rp420.000,Gaming Distro,Jakarta Pusat,"Hi, Welcome to GAMING DISTRO - Authorized Dealer HYPERXProduk ini 100% Original by HYPERXHarap untuk menanyakan stok sebelum orderPengiriman via Ojek-Online harap konfirmasi ke kita dulu sebelum checkoutHarap Lakukan video unboxing (tanpa cut/edit) dari ketika paket diterima guna memudahkan & memberikan info valid saat pelaporan barang jika terdapat kendalaVarian: White Topping / Black Topping / Pink ToppingTidak mencantumkan warna di catatan maka akan dikirim random.Jika sudah mencantumkan warna tetapi barang tidak ready karena sebelumnya tidak tanya stok, TENANG, kami akan konfirmasi ulang sebelum dikirim :)ORDER = AGREEFEATURES:HyperX Pudding Keycaps Full Key Set : HyperX Pudding Keycaps feature a translucent dual-layer style and our signature HyperX font, both of which are designed to provide extra brilliance. These double shot PBT keycaps are thicker, more durable, and more resistant to solvents. The full key set is compatible with HyperX and most other mechanical gaming keyboards and come with a stylish HyperX keycap removal tool for easy installation.Translucent design for lustrous RGB lightingThe dual-layer design of these keycaps is designed to let more light through, making your keyboards RGB lighting even more stunning.Durable double shot PBT materialThese PBT keycaps are made with thick walls and are resistant to wear, friction, and solvents.Signature HyperX fontOur bold, wide font allows for more light to shine through, enhancing the visibility and legibility of the individual keys.Stylish keycap removal tool includedOur keycap removal tool is specially-designed to precisely fit HyperX keycaps.English (US) Layout - 104 Key SetDesigned to enhance RGB lightingTranslucent keycaps with black top (Pudding)Compatible with HyperX mechanical keyboardsPart Number: HKCPXP-BK-US/G",± 1-2 hari,1.216 Feedback Positif,dari 1.275 feedback,https://www.bukalapak.com/p/komputer/aksesoris-226/keyboard/3rl1af9-jual-keycaps-pudding-hyperx-104-keys-for-mechanical-keyboard
Steelseries Prismcaps Universal Double Shot PBT Keycaps Keyboard Black ,,,Rp460.000,Graha Baru Komputer,Jakarta Pusat,"#CATATAN#*HARUS mempunyai video unboxing full uncut atau tanpa potongan sama sekali, untuk menjadi bukti valid dan menghindari gagalnya klaim garansi jika mendapatkan barang cacat fisik dari pabrik atau kekurangan komponen/part barang.*Diwajibkan dan harus membeli asuransi pengiriman yang ada di , untuk menghindari kerusakan pada pengiriman.Dengan membeli barang dari kami berarti sudah membaca dan setuju dengan catatan diatas.SpecificationsMaterial : PBTCompatibilitySteelSeries Keyboards : Apex Pro / Apex Pro TKL, Apex 7 / Apex 7 TKL, Apex 5, Apex M750 / Apex M750 TKLOther Brands : Most MX stems mechanical keyboards even with non-standard bottom rowTidak Support untuk keyboard MembrandBox ContentPrismCapsUS Layout: 104 KeysNordic Layout: 105 KeysExtra ""Non-Standard"" Bottom Row: 16 keysProduct Information Guide",± 1-2 hari,7.155 Feedback Positif,dari 7.339 feedback,https://www.bukalapak.com/p/komputer/aksesoris-226/keyboard/4hg5d97-jual-steelseries-prismcaps-universal-double-shot-pbt-keycaps-keyboard-black
Keycaps Razer PBT Double Shot Quartz Pink for Mechanical Keyboard ,,,Rp509.000,Gaming Distro,Jakarta Pusat,"Hi, Welcome to GAMING DISTRO - Authorized Dealer RAZERProduk ini 100% Original by RAZERHarap untuk menanyakan stok sebelum orderPengiriman via Ojek-Online harap konfirmasi ke kita dulu sebelum checkoutHarap Lakukan video unboxing (tanpa cut/edit) dari ketika paket diterima guna memudahkan & memberikan info valid saat pelaporan barang jika terdapat kendalaFEATURES:Superior PBT MaterialDoubleshot Molding With Ultra-Thin FontWorks With Popular Keyboard LayoutsDOUBLESHOT DURABILITY: Its time to get tough and secure your keys to victory with the Razer PBT Keycap Upgrade Set. Designed to endure the most intense gaming, these doubleshot PBT keycaps arent here to win one battletheyre here to win the war.SUPERIOR PBT MATERIAL: Harder and more durable than ABS or PVC, PBT is a high-grade thermoplastic that gives the keycaps a sturdy, textured look and feel that wont wear down to a shiny finish. Crafted with extra-thick walls, they are well equipped to handle extreme use and produce more satisfying keystrokes because of their solid build. Available in 4 different colors.DOUBLESHOT MOLDING WITH ULTRA-THIN FONT: Using our unique doubleshot precision molding process, the keycap labels are fade-resistant and have the thinnest font ever produced on PBT keycaps. They are also designed to be backlight compatible, and work best with our keyboards Razer Chroma RGB lighting.WORKS WITH POPULAR KEYBOARD LAYOUTS: The Razer PBT Keycap Upgrade Set works with Razer and standard 104/105 key US or UK layouts, and comes with 120 doubleshot PBT keycaps and additional stabilizers for optical and mechanical keyboards.TECH SPECS:Shine-resistant PBT materialBacklight compatibleFits all Razer mechanical and optical keyboardsFits all cross-shaped axis (Cherry-style) switchesFits both Razer and standard 104/105 key US and UK layoutsIncludes mechanical and optical keyboard stabilizers",± 1-2 hari,1.216 Feedback Positif,dari 1.275 feedback,https://www.bukalapak.com/p/komputer/aksesoris-226/keyboard/4hofomm-jual-keycaps-razer-pbt-double-shot-quartz-pink-for-mechanical-keyboard
HyperX PBT Double Shot Keycaps Full-key Set Key Caps Gaming Keyboard ,,,Rp471.000,DUNIA COMPUTER DAN SERVICE,Jakarta Barat,Note:Garansi Resmi 2 Tahun Hyperx IndonesiaSpecs :HyperX PBT Double Shot Keycaps Full-key Set Key Caps Gaming KeyboardEnglish (US) Layout - 104 Key SetDesigned to enhance RGB lightingTranslucent keycaps with white top (Pudding)Compatible with HyperX mechanical keyboardsMaterial : PBTCompatibility : Fits all HyperX mechanical keyboardsFits most mechanical keyboards with standard bottom row,± 13 jam,11.741 Feedback Positif,dari 12.296 feedback,https://www.bukalapak.com/p/g-komputer/g-aksesoris/g-keyboard/4hcrfg1-jual-hyperx-pbt-double-shot-keycaps-full-key-set-key-caps-gaming-keyboard
